{
  "schema_version": 1,
  "event_id": "30000000-0000-4000-8000-000000000001",
  "tenant_id": "10000000-0000-4000-8000-000000000001",
  "case_id": "20000000-0000-4000-8000-000000000001",
  "case_sequence": 1,
  "kind": "source_message",
  "recorded_at": "2026-10-05T10:00:00Z",
  "occurred_at": null,
  "source": {
    "label": "S1",
    "kind": "pasted_text",
    "text": "The contract pays $1,500 monthly. Applicants pay no fees.",
    "redacted": false,
    "claimed_sender": "Purported recruiter (synthetic example)"
  },
  "claims": [
    {
      "claim_id": "40000000-0000-4000-8000-000000000001",
      "topic": "applicant_fee",
      "statement": "The sender claims applicants do not pay fees.",
      "attribution": "source_sender_claim",
      "evidence": {
        "quote": "Applicants pay no fees.",
        "start": 34,
        "end": 57
      }
    }
  ],
  "correction": null,
  "verification": null,
  "provenance": {
    "extractor": "deepseek",
    "requested_model": "deepseek-flash",
    "returned_model": null,
    "prompt_version": "extract-v1-synthetic-fixture"
  }
}
